{
  "entries": [
    {
      "backup_strategy": "module-22-versioned-backup-before-write",
      "fixture": "ts/product-contracts/fixtures/product-task-disk-v1.json",
      "fixture_sha256": "bc182434161011ab8f9c853c3ee6c493409e6cfa3cb91cb05e7efc7fda935475",
      "from": "v1",
      "id": "product-task-disk-v1-to-v4",
      "idempotence_test": "ts/tests/product-contracts/legacy-reader-migrations.test.ts",
      "idempotence_test_id": "product-task-disk-v1-to-v4:idempotence",
      "layer": "disk",
      "migration_owner_module": "02",
      "physical_location": "ProductTaskService product store",
      "positive_test": "ts/tests/product-contracts/legacy-reader-migrations.test.ts",
      "positive_test_id": "product-task-disk-v1-to-v4:positive",
      "reader_entry": "ts/src/server/product/taskService.ts",
      "release_association": "first-versioned-migration-release",
      "status": "supported",
      "storage_id": "product-task-store",
      "to": "v4"
    },
    {
      "backup_strategy": "module-22-versioned-backup-before-write",
      "fixture": "ts/product-contracts/fixtures/product-task-disk-v3.json",
      "fixture_sha256": "ddb94f398ca3ac3c118df7c02c964b4ff2dac424870589bb5b37455fa47223cb",
      "from": "v3",
      "id": "product-task-disk-v3-to-v4",
      "idempotence_test": "ts/tests/product-contracts/legacy-reader-migrations.test.ts",
      "idempotence_test_id": "product-task-disk-v3-to-v4:idempotence",
      "layer": "disk",
      "migration_owner_module": "02",
      "physical_location": "ProductTaskService product store",
      "positive_test": "ts/tests/product-contracts/legacy-reader-migrations.test.ts",
      "positive_test_id": "product-task-disk-v3-to-v4:positive",
      "reader_entry": "ts/src/server/product/taskService.ts",
      "release_association": "first-versioned-migration-release",
      "status": "supported",
      "storage_id": "product-task-store",
      "to": "v4"
    },
    {
      "backup_strategy": "module-22-versioned-backup-before-write",
      "fixture": "ts/product-contracts/fixtures/product-task-disk-v4.json",
      "fixture_sha256": "0987b9dfced3f98f34e9edde3352a74315e44ff80c23c379ea9fc680c339ca04",
      "from": "v4",
      "id": "product-task-disk-v4-current",
      "idempotence_test": "ts/tests/product-contracts/legacy-reader-migrations.test.ts",
      "idempotence_test_id": "product-task-disk-v4-current:idempotence",
      "layer": "disk",
      "migration_owner_module": "02",
      "physical_location": "ProductTaskService product store",
      "positive_test": "ts/tests/product-contracts/legacy-reader-migrations.test.ts",
      "positive_test_id": "product-task-disk-v4-current:positive",
      "reader_entry": "ts/src/server/product/taskService.ts",
      "release_association": "current-reader",
      "status": "current",
      "storage_id": "product-task-store",
      "to": "v4"
    },
    {
      "from": "v2",
      "id": "product-task-disk-v2",
      "layer": "disk",
      "migration_owner_module": "02",
      "physical_location": "ProductTaskService product store",
      "reason": "No immutable positive fixture may promise automatic migration before module 02 supplies one.",
      "status": "provisional",
      "storage_id": "product-task-store",
      "to": "v4"
    },
    {
      "from": "v2",
      "id": "product-task-wire-v2-current-only",
      "layer": "wire",
      "migration_owner_module": "02",
      "physical_location": "ProductTask public domain/API schema",
      "reader_entry": "ts/shared/product/domain.ts",
      "reason": "Wire v2 is not a disk migration input.",
      "status": "current_only",
      "storage_id": "product-task-wire",
      "to": "v2"
    },
    {
      "backup_strategy": "module-22-versioned-backup-before-write",
      "fixture": "ts/product-contracts/fixtures/media-disk-v1-inline-reference-images.json",
      "fixture_sha256": "cee52fe05acdfd135dc9647c3604d9b89304dfc8f19b6676e41d488049f624aa",
      "from": "v1-inline-reference_images",
      "id": "media-disk-v1-inline-reference-images-to-private-asset",
      "idempotence_test": "ts/tests/product-contracts/legacy-reader-migrations.test.ts",
      "idempotence_test_id": "media-disk-v1-inline-reference-images-to-private-asset:idempotence",
      "layer": "disk",
      "migration_owner_module": "12",
      "physical_location": "MediaProjectService project root",
      "positive_test": "ts/tests/product-contracts/legacy-reader-migrations.test.ts",
      "positive_test_id": "media-disk-v1-inline-reference-images-to-private-asset:positive",
      "reader_entry": "ts/src/server/services/mediaProjectService.ts",
      "release_association": "first-versioned-migration-release",
      "status": "supported",
      "storage_id": "media-project",
      "to": "v1-private-asset"
    },
    {
      "backup_strategy": "existing-before-migration-backup; module-22-policy-governs-release-migration",
      "fixture": "ts/product-contracts/fixtures/provider-root-v1-legacy-index.json",
      "fixture_sha256": "7bfaa0f270c284b78ed21669db0f6b473416951918ca5e445620d9c2c59bd283",
      "from": "root-v1-legacy-index",
      "id": "provider-root-v1-legacy-index-to-provider-index-v2",
      "idempotence_test": "ts/tests/product-contracts/legacy-reader-migrations.test.ts",
      "idempotence_test_id": "provider-root-v1-legacy-index-to-provider-index-v2:idempotence",
      "layer": "disk",
      "migration_owner_module": "04",
      "physical_location": "CLAUDE_CONFIG_DIR/providers.json to CLAUDE_CONFIG_DIR/billiardbuddy/providers.json",
      "positive_test": "ts/tests/product-contracts/legacy-reader-migrations.test.ts",
      "positive_test_id": "provider-root-v1-legacy-index-to-provider-index-v2:positive",
      "reader_entry": "ts/src/server/services/persistentStorageMigrations.ts",
      "release_association": "first-versioned-migration-release",
      "status": "supported",
      "storage_id": "provider-index",
      "to": "provider-index-v2"
    },
    {
      "id": "managed-settings-tested-fields",
      "layer": "disk",
      "reason": "Current field normalizers lack a versioned immutable fixture, positive/idempotence migration test, backup contract, and release evidence.",
      "status": "unsupported",
      "storage_id": "managed-settings"
    },
    {
      "id": "cron-tested-fields",
      "layer": "disk",
      "reason": "No versioned immutable fixture, reader/migration test, backup contract, or release evidence is registered.",
      "status": "unsupported",
      "storage_id": "cron"
    },
    {
      "id": "ordinary-settings-history",
      "layer": "disk",
      "reason": "No versioned immutable fixture is registered.",
      "status": "unsupported",
      "storage_id": "ordinary-settings"
    },
    {
      "id": "memory-history",
      "layer": "disk",
      "reason": "No versioned immutable fixture is registered.",
      "status": "unsupported",
      "storage_id": "memory"
    },
    {
      "id": "recruiting-history",
      "layer": "disk",
      "reason": "No legacy persisted schema is evidenced.",
      "status": "unsupported",
      "storage_id": "recruiting"
    },
    {
      "id": "cron-run-log-history",
      "layer": "disk",
      "reason": "No versioned immutable fixture is registered.",
      "status": "unsupported",
      "storage_id": "cron-run-log"
    },
    {
      "id": "desktop-localstorage-history",
      "layer": "localStorage",
      "reason": "No versioned immutable fixture is registered.",
      "status": "unsupported",
      "storage_id": "desktop-localstorage"
    }
  ],
  "matrix_revision": "bb-01a-initial",
  "matrix_schema_version": 1,
  "source_sha256": "a37dfaffec5d240000004a2360bc19b7cbd636f17c450fc458fdb7fd043daf3e"
}
